{"artifact_sha256":"1f3340f26f92d21387d3debeddeb42428fe3ab5988cfd6e5a6fc95062d262d8f","candidates":[{"candidate_id":"candidate-e64d2bc3bc69cba50ca282e8b2fbf495d5920411e6a9d547a19ff0ae0be1e418","curation":{"deduplicated":false,"displacement":"not-applicable","visits":[]},"discovery_source":"scanner","evidence":{"absent":[],"present":["scanner-entry"],"rejected":["non-text-file"],"state":"rejected","unknown":[]},"final":{"rank":null,"result":"ranking-ineligible","selected":false,"selection_heuristic":null,"selection_reason":null},"normalized_path":".gitattributes","ranking":{"contributions":[],"eligibility_reason":"non-text-file","eligible":false,"fan_in":0,"input_position":1,"ranked_position":null,"referenced_by":0,"score":null,"signals":[],"tie_break":{"fan_in":0,"path":".gitattributes","score":null}}},{"candidate_id":"candidate-aaba3c202bedbe48be993d350e8ef60a31d6b0b7e515c1483c009cdf729b742b","curation":{"deduplicated":false,"displacement":"not-applicable","visits":[]},"discovery_source":"scanner","evidence":{"absent":["normalized-ranking-signal"],"present":["scanner-entry"],"rejected":[],"state":"present","unknown":[]},"final":{"rank":null,"result":"not-selected","selected":false,"selection_heuristic":null,"selection_reason":null},"normalized_path":".gitignore","ranking":{"contributions":[],"eligibility_reason":"ranking-eligible","eligible":true,"fan_in":0,"input_position":2,"ranked_position":8,"referenced_by":0,"score":0,"signals":[],"tie_break":{"fan_in":0,"path":".gitignore","score":0}}},{"candidate_id":"candidate-49362a8f9b1ff3bed97586c532623f55a4523ec93843f0047167d8bf63cea3af","curation":{"deduplicated":false,"displacement":"not-applicable","visits":[]},"discovery_source":"scanner","evidence":{"absent":[],"present":["scanner-entry"],"rejected":["non-text-file"],"state":"rejected","unknown":[]},"final":{"rank":null,"result":"ranking-ineligible","selected":false,"selection_heuristic":null,"selection_reason":null},"normalized_path":"assets/gpt2_124M_loss.png","ranking":{"contributions":[],"eligibility_reason":"non-text-file","eligible":false,"fan_in":0,"input_position":3,"ranked_position":null,"referenced_by":0,"score":null,"signals":[],"tie_break":{"fan_in":0,"path":"assets/gpt2_124M_loss.png","score":null}}},{"candidate_id":"candidate-ac9c938544103d93c0d5ba7321e12f8b6b28f0682e45d6384b81ae8e6a0bcf70","curation":{"deduplicated":false,"displacement":"not-applicable","visits":[]},"discovery_source":"scanner","evidence":{"absent":[],"present":["scanner-entry"],"rejected":["non-text-file"],"state":"rejected","unknown":[]},"final":{"rank":null,"result":"ranking-ineligible","selected":false,"selection_heuristic":null,"selection_reason":null},"normalized_path":"assets/nanogpt.jpg","ranking":{"contributions":[],"eligibility_reason":"non-text-file","eligible":false,"fan_in":0,"input_position":4,"ranked_position":null,"referenced_by":0,"score":null,"signals":[],"tie_break":{"fan_in":0,"path":"assets/nanogpt.jpg","score":null}}},{"candidate_id":"candidate-772ec32afd1cc97e3d6385d2a18da5767fd34abf8696cd55d5374dc143f05456","curation":{"deduplicated":false,"displacement":"not-applicable","visits":[]},"discovery_source":"scanner","evidence":{"absent":["normalized-ranking-signal"],"present":["scanner-entry"],"rejected":[],"state":"present","unknown":[]},"final":{"rank":null,"result":"not-selected","selected":false,"selection_heuristic":null,"selection_reason":null},"normalized_path":"bench.py","ranking":{"contributions":[],"eligibility_reason":"ranking-eligible","eligible":true,"fan_in":0,"input_position":5,"ranked_position":9,"referenced_by":0,"score":0,"signals":[],"tie_break":{"fan_in":0,"path":"bench.py","score":0}}},{"candidate_id":"candidate-ce533358ad39c158823be1175db17cc5c0cf96caadc885d906bec0cefcb42ad0","curation":{"deduplicated":false,"displacement":"not-applicable","visits":[]},"discovery_source":"scanner","evidence":{"absent":["normalized-ranking-signal"],"present":["scanner-entry"],"rejected":[],"state":"present","unknown":[]},"final":{"rank":null,"result":"not-selected","selected":false,"selection_heuristic":null,"selection_reason":null},"normalized_path":"config/eval_gpt2_large.py","ranking":{"contributions":[{"name":"path-depth","value":-4}],"eligibility_reason":"ranking-eligible","eligible":true,"fan_in":0,"input_position":6,"ranked_position":13,"referenced_by":0,"score":-4,"signals":[],"tie_break":{"fan_in":0,"path":"config/eval_gpt2_large.py","score":-4}}},{"candidate_id":"candidate-d89759cb2a91e5bd9c4200397f8744c0e026d5ceeab45b7edd0518a072167b69","curation":{"deduplicated":false,"displacement":"not-applicable","visits":[]},"discovery_source":"scanner","evidence":{"absent":["normalized-ranking-signal"],"present":["scanner-entry"],"rejected":[],"state":"present","unknown":[]},"final":{"rank":null,"result":"not-selected","selected":false,"selection_heuristic":null,"selection_reason":null},"normalized_path":"config/eval_gpt2_medium.py","ranking":{"contributions":[{"name":"path-depth","value":-4}],"eligibility_reason":"ranking-eligible","eligible":true,"fan_in":0,"input_position":7,"ranked_position":14,"referenced_by":0,"score":-4,"signals":[],"tie_break":{"fan_in":0,"path":"config/eval_gpt2_medium.py","score":-4}}},{"candidate_id":"candidate-d457d21ccc3867b99a2824362304171105dd3570e7f87aa35064b69480fe68cf","curation":{"deduplicated":false,"displacement":"not-applicable","visits":[]},"discovery_source":"scanner","evidence":{"absent":["normalized-ranking-signal"],"present":["scanner-entry"],"rejected":[],"state":"present","unknown":[]},"final":{"rank":null,"result":"not-selected","selected":false,"selection_heuristic":null,"selection_reason":null},"normalized_path":"config/eval_gpt2_xl.py","ranking":{"contributions":[{"name":"path-depth","value":-4}],"eligibility_reason":"ranking-eligible","eligible":true,"fan_in":0,"input_position":8,"ranked_position":15,"referenced_by":0,"score":-4,"signals":[],"tie_break":{"fan_in":0,"path":"config/eval_gpt2_xl.py","score":-4}}},{"candidate_id":"candidate-1c0fce933a1f1514645457924edaa60faaed0977d40b296f63a09bee7c7734bf","curation":{"deduplicated":false,"displacement":"not-applicable","visits":[]},"discovery_source":"scanner","evidence":{"absent":["normalized-ranking-signal"],"present":["scanner-entry"],"rejected":[],"state":"present","unknown":[]},"final":{"rank":null,"result":"not-selected","selected":false,"selection_heuristic":null,"selection_reason":null},"normalized_path":"config/eval_gpt2.py","ranking":{"contributions":[{"name":"path-depth","value":-4}],"eligibility_reason":"ranking-eligible","eligible":true,"fan_in":0,"input_position":9,"ranked_position":16,"referenced_by":0,"score":-4,"signals":[],"tie_break":{"fan_in":0,"path":"config/eval_gpt2.py","score":-4}}},{"candidate_id":"candidate-6552af787f7778588c7875ca7f1cecbe78e750d5e9f6e27a8c64bb2b3c52d9d8","curation":{"deduplicated":false,"displacement":"not-applicable","visits":[]},"discovery_source":"scanner","evidence":{"absent":["normalized-ranking-signal"],"present":["scanner-entry"],"rejected":[],"state":"present","unknown":[]},"final":{"rank":null,"result":"not-selected","selected":false,"selection_heuristic":null,"selection_reason":null},"normalized_path":"config/finetune_shakespeare.py","ranking":{"contributions":[{"name":"path-depth","value":-4}],"eligibility_reason":"ranking-eligible","eligible":true,"fan_in":0,"input_position":10,"ranked_position":17,"referenced_by":0,"score":-4,"signals":[],"tie_break":{"fan_in":0,"path":"config/finetune_shakespeare.py","score":-4}}},{"candidate_id":"candidate-330a18ef45b68527b86ea4841b5c355670580c3b3479fd0426afddb978efebc5","curation":{"deduplicated":false,"displacement":"not-applicable","visits":[]},"discovery_source":"scanner","evidence":{"absent":["normalized-ranking-signal"],"present":["scanner-entry"],"rejected":[],"state":"present","unknown":[]},"final":{"rank":null,"result":"not-selected","selected":false,"selection_heuristic":null,"selection_reason":null},"normalized_path":"config/train_gpt2.py","ranking":{"contributions":[{"name":"path-depth","value":-4}],"eligibility_reason":"ranking-eligible","eligible":true,"fan_in":0,"input_position":11,"ranked_position":18,"referenced_by":0,"score":-4,"signals":[],"tie_break":{"fan_in":0,"path":"config/train_gpt2.py","score":-4}}},{"candidate_id":"candidate-112b9a10cacaa4106b528621ae2fcc75d1601588ca8e4ba880b7936256b174da","curation":{"deduplicated":false,"displacement":"not-applicable","visits":[]},"discovery_source":"scanner","evidence":{"absent":["normalized-ranking-signal"],"present":["scanner-entry"],"rejected":[],"state":"present","unknown":[]},"final":{"rank":null,"result":"not-selected","selected":false,"selection_heuristic":null,"selection_reason":null},"normalized_path":"config/train_shakespeare_char.py","ranking":{"contributions":[{"name":"path-depth","value":-4}],"eligibility_reason":"ranking-eligible","eligible":true,"fan_in":0,"input_position":12,"ranked_position":19,"referenced_by":0,"score":-4,"signals":[],"tie_break":{"fan_in":0,"path":"config/train_shakespeare_char.py","score":-4}}},{"candidate_id":"candidate-bda699c7ed20d8e845358bb1a5eaeecfda3552de15e8422161948e5a7d605ed9","curation":{"deduplicated":false,"displacement":"not-applicable","visits":[{"cap":null,"decision":"selected","deduplicated":false,"displaced_by":null,"entry_position":1,"heuristic":"literal-local-reference","quota":null,"reason":"referenced by 3 local file(s)","selected_count_on_entry":2,"stage":"literal-reference","stage_ordinal":13}]},"discovery_source":"scanner","evidence":{"absent":["normalized-ranking-signal"],"present":["scanner-entry"],"rejected":[],"state":"present","unknown":[]},"final":{"rank":3,"result":"selected","selected":true,"selection_heuristic":"literal-local-reference","selection_reason":"referenced by 3 local file(s)"},"normalized_path":"configurator.py","ranking":{"contributions":[{"name":"literal-local-reference","value":36}],"eligibility_reason":"ranking-eligible","eligible":true,"fan_in":0,"input_position":13,"r